{
  "$schema": "https://json-schema.org/draft/2020-12/schema",
  "$id": "https://volley.invalid/schema/1/data-config-schema",
  "type": "object",
  "additionalProperties": false,
  "properties": {
    "$schema": {
      "type": "string"
    },
    "$id": {
      "type": "string"
    },
    "type": {
      "type": [
        "string",
        "array"
      ]
    },
    "additionalProperties": {
      "type": [
        "boolean",
        "object"
      ]
    },
    "properties": {
      "type": "object"
    },
    "required": {
      "type": "array",
      "items": {
        "type": "string"
      }
    },
    "allOf": {
      "type": "array"
    }
  },
  "required": [
    "$schema"
  ]
}
